producto_unificado,categorias,sub-categoria,Indice
Celular libre Xiaomi REDMI NOTE 11 4gb 128gb negro,electrodomesticos y tecnologia,celulares,celulares
Celular libre Motorola g23 4gb 128 gb azul,electrodomesticos y tecnologia,celulares,celulares
Celular Libre Samsung GALAXY A04E 3GB 64GB negro,electrodomesticos y tecnologia,celulares,celulares
Celular Kodak Seren d55 lx 2GB 32GB negro,electrodomesticos y tecnologia,celulares,celulares
Smartwatch Xinji N2 negro,electrodomesticos y tecnologia,celulares,celulares
Celular libre Samsung Galaxy A54 8GB 128GB menta,electrodomesticos y tecnologia,celulares,celulares
Celular Libre Samsung GALAXY A04E 3GB 32GB copper,electrodomesticos y tecnologia,celulares,celulares
"Monitor led Chiq 27"" fhd hdmi vga",electrodomesticos y tecnologia,informatica,informatica
"Monitor LED 32"" CHIQ / QHD/ HDMI/ 32F600",electrodomesticos y tecnologia,informatica,informatica
"Tablet 10"" Exo 4GB 64GB WAVE I101 T2",electrodomesticos y tecnologia,informatica,informatica
Impresora Multifuncion sist.cont. Canon wi-fi pixma g5010,electrodomesticos y tecnologia,informatica,informatica
Mouse optico Maxell plata 5 botones mod 438418,electrodomesticos y tecnologia,informatica,informatica
Cable adaptador Noga audio miniplug negro,electrodomesticos y tecnologia,informatica,informatica
Reproductor streaming Roku Express 3930mx 512MB,electrodomesticos y tecnologia,informatica,informatica
Yogur entero natural Yogurisimo sin azucar 300 g.,lacteos,yogures,"Leche, productos lacteos, huevos y alimentos vegetales"
Yogur bebible frutilla La SerenIsima clasico 900 g.,lacteos,yogures,"Leche, productos lacteos, huevos y alimentos vegetales"
Yogur batido frutilla La Serenisima clasico 120 g.,lacteos,yogures,"Leche, productos lacteos, huevos y alimentos vegetales"
Yogur descremado cremoso La serenisima 120 g.,lacteos,yogures,"Leche, productos lacteos, huevos y alimentos vegetales"
Yogur bebible Carrefour de frutilla classic 900 g.,lacteos,yogures,"Leche, productos lacteos, huevos y alimentos vegetales"
Yogur entero cremoso La serenisima sabor vainilla 120 g.,lacteos,yogures,"Leche, productos lacteos, huevos y alimentos vegetales"
Yogur griego Yogurisimo sabor frutilla en pote 125 g.,lacteos,yogures,"Leche, productos lacteos, huevos y alimentos vegetales"
Leche entera UAT Carrefour classic tetra 1 lt.,lacteos,leches,"Leche, productos lacteos, huevos y alimentos vegetales"
Leche UAT entera Carrefour classic brik 1 lt.,lacteos,leches,"Leche, productos lacteos, huevos y alimentos vegetales"
Leche modificada en polvo Armonia 400 g.,lacteos,leches,"Leche, productos lacteos, huevos y alimentos vegetales"
Leche en polvo entera Purisima avant 800 g.,lacteos,leches,"Leche, productos lacteos, huevos y alimentos vegetales"
Leche UAT parcialmente descremada Carrefour classic brik 1 lt.,lacteos,leches,"Leche, productos lacteos, huevos y alimentos vegetales"
Leche La serenisima liviana 1% 1L,lacteos,leches,"Leche, productos lacteos, huevos y alimentos vegetales"
Leche La serenisima clasica 3% 1L.,lacteos,leches,"Leche, productos lacteos, huevos y alimentos vegetales"
Te en saquitos diamantado Taragui x 50 uni,desayuno,infusiones,infusiones
Cacao en polvo Nesquik 150 g.,desayuno,infusiones,infusiones
Te de manzanilla en saquitos Carrefour 25 u.,desayuno,infusiones,infusiones
Mate cocido Amanda 25 uni,desayuno,infusiones,infusiones
Te en saquitos Green Hills 50 u.,desayuno,infusiones,infusiones
Mate cocido en saquitos Carrefour sin TACC x 50 un.,desayuno,infusiones,infusiones
Te en saquitos Carrefour sin TACC x 25 un.,desayuno,infusiones,infusiones
